,title,date,author,text,clean_text,processed_text,YearMonth,word_count,meaningfull_words_text
1,Netflix’s new Michelle Obama documentary arrives May 6th,2020-04-27,Jay Peters,"Netflix , that a new documentary about former first lady Michelle Obama will be available on the streaming service starting Wednesday, May 6th. The documentary is called ,, which is the same title as her memoir released in 2018. , will cover some history of Obama’s life from the memoir, ,, and give a behind-the-scenes look at experiences from her 34-city book tour. ,“Those months I spent traveling — meeting and connecting with people in cities across the globe — drove home the idea that what we share in common is deep and real and can’t be messed with,” said Obama in a statement. “In groups large and small, young and old, unique and united, we came together and shared stories, filling those spaces with our joys, worries, and dreams. We processed the past and imagined a better future. In talking about the idea of ‘becoming,’ many of us dared to say our hopes out loud.”,You can watch a trailer for the new documentary ,:,Michelle and President Barack Obama signed a multiyear agreement with Netflix , to create “a diverse mix of content, including the potential for scripted series, unscripted series, docuseries, documentaries, and features” from their production company, Higher Ground Productions. The Obamas signed a deal with Spotify to produce exclusive podcasts for the platform in ,. ",netflix that a new documentary about former first lady michelle obama will be available on the streaming service starting wednesday may th the documentary is called which is the same title as her memoir released in will cover some history of obama s life from the memoir and give a behind the scenes look at experiences from her city book tour those months i spent traveling meeting and connecting with people in cities across the globe drove home the idea that what we share in common is deep and real and can t be messed with said obama in a statement in groups large and small young and old unique and united we came together and shared stories filling those spaces with our joys worries and dreams we processed the past and imagined a better future in talking about the idea of becoming many of us dared to say our hopes out loud you can watch a trailer for the new documentary michelle and president barack obama signed a multiyear agreement with netflix to create a diverse mix of content including the potential for scripted series unscripted series docuseries documentaries and features from their production company higher ground productions the obamas signed a deal with spotify to produce exclusive podcasts for the platform in ,netflix new documentary former first lady michelle obama available streaming service starting wednesday may documentary called title memoir released cover history obama life memoir give behind scene look experience city book tour month spent traveling meeting connecting people city across globe drove home idea share common deep real messed said obama statement group large small young old unique united came together shared story filling space joy worry dream processed past imagined better future talking idea becoming many dared say hope loud watch trailer new documentary michelle president barack obama signed multiyear agreement netflix create diverse mix content including potential scripted series unscripted series docuseries documentary feature production company higher ground production obamas signed deal spotify produce exclusive podcasts platform,2020-04-01,119,lady michelle obama wednesday memoir cover obama memoir city tour spent traveling meeting connecting city globe drove share common deep messed obama statement large unique shared filling joy worry dream processed past imagined talking becoming dared hope loud michelle president barack obama signed multiyear agreement create diverse mix potential scripted unscripted docuseries higher ground obamas signed spotify produce podcasts
5,Mindy Kaling’s new teen sitcom Never Have I Ever is an empathetic exploration of grief,2020-05-01,Joshua Rivera,"If you told everyone exactly how high school would play out, odds are many would opt the hell out. High school in America is a bizarre and unkind time, a collective coming-of-age story that has as much room for variety as there are people who go through it. ,, a new Netflix sitcom from , creator Mindy Kaling and Lang Fisher, takes the broad strokes of high school and gives them new life by centering its story on an Indian-American girl. It’s an absolute delight, one of the most pleasant new binge-watches you can do right now. ,That doesn’t mean the show is all sunshine — , begins with a tragedy when protagonist Devi Vishwakumar’s (Maitreyi Ramakrishnan) father Mohan (Sendhil Ramamurthy) suddenly dies, and shortly after, Devi inexplicably loses the use of her legs. (This is all in the first few minutes). As Devi is starting to get used to life without her father and with her disability, her mobility returns, just as curiously as it left. , is the story of Devi’s attempt to return to a normal life, and Devi wants to return with a bang — literally, by losing her virginity to Paxton Hall-Yoshida (Darren Barnet) the hottest boy in school. ,Perhaps this might not strike you as a healthy thing for someone, real or fictional, to do. That would be the point: , isn’t just an Indian-American take on the coming-of-age story, but also a story that takes teen rom-com tropes and turns them into a vehicle for exploring grief. None of this ever takes a backseat to ,’s comedy or its earnest, empathetic storytelling. The show strives to keep its stakes small and focused on Devi and her friends and family, but they’re surrounded by a cast of friends and family diverse and interesting enough to support a much bigger show. ,While each character can’t have a subplot of their own, they’re all afforded the potential for depth. Every character is going through something, experiencing their foundational traumas in real time. The central conflict of the show is Devi’s inability to see this, slowly realizing that the process of dealing with her own extraordinary grief blinds her to what others are experiencing, and that dealing with that grief poorly can also cost her the connections that will help her move on. ,Again: ,is also a very good comedy that consistently delights. There’s clever and fun narration from tennis superstar John McEnroe (there’s a reason for this); a bright, danceable soundtrack that prominently features Robyn’s “Dancing On My Own” in the pilot and stays in that sonic milieu throughout; and it features a cast of wonderfully charismatic young actors. , feels like what would have been a cult favorite in a previous generation of television, a ,-style one-season wonder. But times are very different now, and an Indian-American lead is a refreshing change for this type of show — especially one that might last.",if you told everyone exactly how high school would play out odds are many would opt the hell out high school in america is a bizarre and unkind time a collective coming of age story that has as much room for variety as there are people who go through it a new netflix sitcom from creator mindy kaling and lang fisher takes the broad strokes of high school and gives them new life by centering its story on an indian american girl it s an absolute delight one of the most pleasant new binge watches you can do right now that doesn t mean the show is all sunshine begins with a tragedy when protagonist devi vishwakumar s maitreyi ramakrishnan father mohan sendhil ramamurthy suddenly dies and shortly after devi inexplicably loses the use of her legs this is all in the first few minutes as devi is starting to get used to life without her father and with her disability her mobility returns just as curiously as it left is the story of devi s attempt to return to a normal life and devi wants to return with a bang literally by losing her virginity to paxton hall yoshida darren barnet the hottest boy in school perhaps this might not strike you as a healthy thing for someone real or fictional to do that would be the point isn t just an indian american take on the coming of age story but also a story that takes teen rom com tropes and turns them into a vehicle for exploring grief none of this ever takes a backseat to s comedy or its earnest empathetic storytelling the show strives to keep its stakes small and focused on devi and her friends and family but they re surrounded by a cast of friends and family diverse and interesting enough to support a much bigger show while each character can t have a subplot of their own they re all afforded the potential for depth every character is going through something experiencing their foundational traumas in real time the central conflict of the show is devi s inability to see this slowly realizing that the process of dealing with her own extraordinary grief blinds her to what others are experiencing and that dealing with that grief poorly can also cost her the connections that will help her move on again is also a very good comedy that consistently delights there s clever and fun narration from tennis superstar john mcenroe there s a reason for this a bright danceable soundtrack that prominently features robyn s dancing on my own in the pilot and stays in that sonic milieu throughout and it features a cast of wonderfully charismatic young actors feels like what would have been a cult favorite in a previous generation of television a style one season wonder but times are very different now and an indian american lead is a refreshing change for this type of show especially one that might last ,told everyone exactly high school would play odds many would opt hell high school america bizarre unkind time collective coming age story much room variety people new netflix sitcom creator mindy kaling lang fisher take broad stroke high school give new life centering story indian american girl absolute delight one pleasant new binge watch right mean show sunshine begin tragedy protagonist devi vishwakumar maitreyi ramakrishnan father mohan sendhil ramamurthy suddenly dy shortly devi inexplicably loses use leg first minute devi starting get used life without father disability mobility return curiously left story devi attempt return normal life devi want return bang literally losing virginity paxton hall yoshida darren barnet hottest boy school perhaps might strike healthy thing someone real fictional would point indian american take coming age story also story take teen rom com trope turn vehicle exploring grief none ever take backseat comedy earnest empathetic storytelling show strives keep stake small focused devi friend family surrounded cast friend family diverse interesting enough support much bigger show character subplot afforded potential depth every character going something experiencing foundational trauma real time central conflict show devi inability see slowly realizing process dealing extraordinary grief blind others experiencing dealing grief poorly also cost connection help move also good comedy consistently delight clever fun narration tennis superstar john mcenroe reason bright danceable soundtrack prominently feature robyn dancing pilot stay sonic milieu throughout feature cast wonderfully charismatic young actor feel like would cult favorite previous generation television style one season wonder time different indian american lead refreshing change type show especially one might last,2020-04-01,260,told exactly odds opt hell bizarre unkind collective age room variety sitcom mindy kaling lang fisher broad stroke centering indian absolute delight pleasant binge sunshine tragedy protagonist devi vishwakumar maitreyi ramakrishnan father mohan sendhil ramamurthy suddenly dy shortly devi inexplicably loses leg devi father disability mobility curiously devi attempt normal devi bang literally losing virginity paxton hall yoshida darren barnet hottest boy strike healthy fictional indian age rom com trope vehicle exploring grief none backseat earnest empathetic storytelling strives stake focused devi surrounded diverse support bigger subplot afforded potential depth experiencing foundational trauma central conflict devi inability realizing process dealing extraordinary grief blind experiencing dealing grief poorly connection consistently delight clever narration tennis superstar john mcenroe bright danceable soundtrack prominently robyn dancing pilot stay sonic milieu wonderfully charismatic cult previous generation wonder indian refreshing type especially
31,"Superstardom isn’t what it used to be, but it can still bring us together",2020-04-27,Joshua Rivera,"On April 21st, CBS aired ,, a concert special recorded to commemorate the fourth anniversary of Prince’s death. Taped on January 28th, two days after the Grammys aired, the concert is immediately notable for being a throwback to our pre-pandemic world of live (at the time) entertainment. But our current , hasn’t just given , a new layer of relevance; it also amplified its intended purpose: highlighting how there is truly no artist like Prince and precious few pop culture icons that can capture the imagination of so many.,By now, we’re used to the way pop culture has fragmented along with our interests. Brands are bigger than stars, and few franchises — most of them owned by Disney — can reliably get the vast majority of the public talking. Shared experiences aren’t really extinct. We still have big-ticket sports broadcasts like the Super Bowl, viral sensations on streaming platforms like ,, and the occasional prestige series that generates a lot of buzz (like the first season of ,). They’re just rarer. ,But with our world in lockdown, pop culture is one of the only things we have left to share with others. The mass culture of the decades prior to the 21st century doesn’t exist anymore, so instead, we’re gathering around remembrances of it: iconic sports games like ,, celebratory concerts like ,, and, in ESPN’s ,about the life of Michael Jordan., is a particularly surreal thing to watch during lockdown. The 10-part documentary follows Jordan during his 1997–98 basketball season with the Chicago Bulls, which would be his last before his second retirement from the sport and his last season with the Bulls. Throughout, the series flashes back to the beginnings of Jordan’s life and career, and then forward to recent interviews with Jordan and those who knew him or followed his remarkable hoops journey (Including “former Chicago resident” Barack Obama).,As a documentary, , is kind of perfunctory, leaning heavily on the fact that Jordan was an unparalleled superstar with a level of fame that’s hard to grasp unless you lived through it. This point is easy to impress. In one memorable bit of archival news footage, a little girl tells a reporter that her parents said, “Do you want Christmas presents under the tree, or do you want to see Michael Jordan?” The implication, of course, is that she is , happy to pick “seeing Michael Jordan.” What kid wouldn’t spring at the chance to see the star of ,?, is similarly bare-bones: not terribly lavish and straightforward almost to a fault, the concert doesn’t do a lot of convincing because it really doesn’t need to. Prince just made damn good music that a lot of people loved, and watching St. Vincent, the Foo Fighters, Miguel, and Gary Clark Jr. cover that music is fun as hell — especially when you hear Dave Grohl say that Prince heard his band cover “Darling Nikki” once and did not like it at all. ,As the pandemic continues to reshape the world, it’s also underscoring the ways it already has been changed. Pop culture hasn’t really reflected that, mostly because it takes time for the things we’re processing in the real world to filter down into our entertainment. We’ve gotten a few glimpses of it, mostly in the compromises that have been made to make sure the show continues to go on in a socially distant fashion: movies , stars ,, interviews being ,.,Our entertainment has quickly adjusted to the new normal of the world, but the way that it reminds us of the old one remains awkward at best. In watching , or ,, we can remember another era in a way that lets us mourn what we lost and what we might never get back. ",on april st cbs aired a concert special recorded to commemorate the fourth anniversary of prince s death taped on january th two days after the grammys aired the concert is immediately notable for being a throwback to our pre pandemic world of live at the time entertainment but our current hasn t just given a new layer of relevance it also amplified its intended purpose highlighting how there is truly no artist like prince and precious few pop culture icons that can capture the imagination of so many by now we re used to the way pop culture has fragmented along with our interests brands are bigger than stars and few franchises most of them owned by disney can reliably get the vast majority of the public talking shared experiences aren t really extinct we still have big ticket sports broadcasts like the super bowl viral sensations on streaming platforms like and the occasional prestige series that generates a lot of buzz like the first season of they re just rarer but with our world in lockdown pop culture is one of the only things we have left to share with others the mass culture of the decades prior to the st century doesn t exist anymore so instead we re gathering around remembrances of it iconic sports games like celebratory concerts like and in espn s about the life of michael jordan is a particularly surreal thing to watch during lockdown the part documentary follows jordan during his basketball season with the chicago bulls which would be his last before his second retirement from the sport and his last season with the bulls throughout the series flashes back to the beginnings of jordan s life and career and then forward to recent interviews with jordan and those who knew him or followed his remarkable hoops journey including former chicago resident barack obama as a documentary is kind of perfunctory leaning heavily on the fact that jordan was an unparalleled superstar with a level of fame that s hard to grasp unless you lived through it this point is easy to impress in one memorable bit of archival news footage a little girl tells a reporter that her parents said do you want christmas presents under the tree or do you want to see michael jordan the implication of course is that she is happy to pick seeing michael jordan what kid wouldn t spring at the chance to see the star of is similarly bare bones not terribly lavish and straightforward almost to a fault the concert doesn t do a lot of convincing because it really doesn t need to prince just made damn good music that a lot of people loved and watching st vincent the foo fighters miguel and gary clark jr cover that music is fun as hell especially when you hear dave grohl say that prince heard his band cover darling nikki once and did not like it at all as the pandemic continues to reshape the world it s also underscoring the ways it already has been changed pop culture hasn t really reflected that mostly because it takes time for the things we re processing in the real world to filter down into our entertainment we ve gotten a few glimpses of it mostly in the compromises that have been made to make sure the show continues to go on in a socially distant fashion movies stars interviews being our entertainment has quickly adjusted to the new normal of the world but the way that it reminds us of the old one remains awkward at best in watching or we can remember another era in a way that lets us mourn what we lost and what we might never get back ,april cbs aired concert special recorded commemorate fourth anniversary prince death taped january two day grammys aired concert immediately notable throwback pre pandemic world live time entertainment current given new layer relevance also amplified intended purpose highlighting truly artist like prince precious pop culture icon capture imagination many used way pop culture fragmented along interest brand bigger star franchise owned disney reliably get vast majority public talking shared experience really extinct still big ticket sport broadcast like super bowl viral sensation streaming platform like occasional prestige series generates lot buzz like first season rarer world lockdown pop culture one thing left share others mass culture decade prior century exist anymore instead gathering around remembrance iconic sport game like celebratory concert like espn life michael jordan particularly surreal thing watch lockdown part documentary follows jordan basketball season chicago bull would last second retirement sport last season bull throughout series flash back beginning jordan life career forward recent interview jordan knew followed remarkable hoop journey including former chicago resident barack obama documentary kind perfunctory leaning heavily fact jordan unparalleled superstar level fame hard grasp unless lived point easy impress one memorable bit archival news footage little girl tell reporter parent said want christmas present tree want see michael jordan implication course happy pick seeing michael jordan kid spring chance see star similarly bare bone terribly lavish straightforward almost fault concert lot convincing really need prince made damn good music lot people loved watching vincent foo fighter miguel gary clark cover music fun hell especially hear dave grohl say prince heard band cover darling nikki like pandemic continues reshape world also underscoring way already changed pop culture really reflected mostly take time thing processing real world filter entertainment gotten glimpse mostly compromise made make sure show continues socially distant fashion movie star interview entertainment quickly adjusted new normal world way reminds old one remains awkward best watching remember another era way let mourn lost might never get back,2020-04-01,325,aired concert recorded commemorate fourth anniversary prince death taped january grammys aired concert immediately notable throwback pre layer relevance amplified intended purpose highlighting truly artist prince precious pop icon capture imagination pop fragmented interest brand bigger owned reliably vast majority public talking shared extinct ticket broadcast super bowl viral sensation occasional prestige generates buzz rarer lockdown pop share mass prior century exist anymore gathering remembrance iconic celebratory concert espn jordan surreal lockdown jordan basketball chicago bull retirement bull flash beginning jordan career forward recent interview jordan knew followed remarkable hoop journey chicago resident barack obama perfunctory leaning heavily jordan unparalleled superstar level fame grasp unless lived impress memorable archival footage reporter christmas tree jordan implication happy pick seeing jordan spring similarly bare bone terribly lavish straightforward fault concert convincing prince damn loved vincent foo fighter miguel gary clark cover hell especially hear dave grohl prince heard band cover darling nikki continues reshape underscoring changed pop reflected processing filter gotten glimpse compromise continues socially distant fashion interview quickly adjusted normal reminds remains awkward remember mourn lost
