title,date,author,text
"In season 4, The Good Place goes back to its strengths","
          Sep 26, 2019,  1:54pm EDT
        ",Samantha Nelson,"The Good Place.,NBC’s cosmic comedy , started in 2016 as a quirky fantasy sitcom starring Kristen Bell as Eleanor Shellstrop, a self-proclaimed “Arizona dirtbag” who winds up in the titular heavenly realm due to a clerical error. Her attempts to avoid being detected and booted to the Bad Place didn’t seem sustainable as a long-term story — but that’s because they were never meant to be. Instead, ,creator Michael Schur and his team defied sitcom traditions by constantly reinventing the show over the course of three seasons, taking the characters through a version of Dante’s ,that ventured to absurdist versions of heaven, hell, and places in between.,That ambition let , deliver some incredible plot twists and biting comedy, but it didn’t always work out. Season 3 suffered from whiplash as it changed the frame and stakes too much. The season started out by questioning whether people could improve themselves after having near-death experiences. Then it had the protagonists acting as bodhisattvas, forsaking their own redemption to help others. Then they wound up fighting to correct a broken system that doomed every human to eternal torment. Without a focused narrative, the humor dulled into a series of gags, propped up by guest stars who overstayed their welcome.,The end of season 3 set up a course correction for the series and its cosmology, bringing the characters back to the Good Place neighborhood where the show started. Schur tasked them with trying to redeem the souls of four dead people, and through them, all humanity. The return to familiar turf works beautifully as the show moves into its fourth and final season, setting up plenty of funny and sweet callbacks. It also shows how much the characters have grown, and how far they’ll still have to go to achieve their goals.,Season 4 picks up immediately after the season 3 finale. Eleanor has taken on the role of the neighborhood’s divine architect, though the cosmic suburb is actually being held together by the near-omniscient artificial being Janet (D’Arcy Carden). They’re joined by the reformed demon Michael (Ted Danson), the perpetually name-dropping socialite Tahani Al-Jamil (Jameela Jamil), and the dumb but endearing troublemaker Jason Mendoza (Manny Jacinto) on a mission to prove that four humans can change for the better, even if they were bad people throughout their lives.,That’s no easy task, given that the damned souls the crew is out to redeem include John Wheaton (Brandon Scott Jones), a gossip columnist chosen by the Bad Place to torment Tahani. Even more challenging is Brent Norwalk (Ben Koldyke), a living embodiment of white male privilege who drops random jabs at ,into rants about political correctness. He also wants to know why he isn’t spending eternity with a list of buddies that’s clearly modeled off the group of hard-partying high-school friends that surrounded Supreme Court Justice Brett Kavanaugh. The team is also one member down, after indecisive philosophy professor Chidi Anagonye (William Jackson Harper) agreed to have his memories erased to help his season 3 love interest, neurologist Simone Garnett (Kirby Howell-Baptiste). ,Putting the characters back in their old neighborhood lets them revisit earlier plots and behaviors from a new perspective. Eleanor feels almost like Bethany Sloane in ,, a normal person saddled with saving the world while still grappling with her own insecurities. Michael, who held the architect role in the first and second seasons as a means of getting humans to emotionally torture each other, has stepped back to let Eleanor shine, but he still delivers some wonderful inspirational speeches that remind viewers of his old wicked ways. His salvation in previous seasons might have seemed rushed, but this season, he’s quick to remind viewers that he knows the other characters so well because he studied the best ways to hurt them.,Tahani is also clearly still struggling to let go of the insecurities that damned her. While her best moments will always involve sharing ludicrous celebrity-laden anecdotes, she has some genuinely touching moments bonding with John by showing how a desire for status can hurt people on both sides of the velvet rope. The writers are also working hard to find more to do with Jason, the cast’s least improved player. He delivers some great laughs in his trashier interactions with Eleanor, but as of episode 4 of the new season, he’s clearly on a path that will push his character to catch up with his compatriots’ growth. (NBC made the first four episodes of the 14-episode season available to critics before the premiere.),Wiping Chidi’s memory lets the show bring back the neurotic, anxious version of the character that Eleanor eventually fell in love with, and it sets up a major conflict, as she’s forced to put aside her feelings for him and drive him and Simone together for the good of the group’s moral experiment. ,has always spent a lot of time dwelling on philosophy, but the overt lectures have taken a back seat this season, aside from Chidi getting Simone to accept that she’s in the afterlife, not just undergoing a complicated hallucination while dying. That scene is a sweet moment that rekindles the strong chemistry the actors had in season 3, even if it does mark an end to Simone’s hilarious attempts to prove she’s dreaming, which include showing up to a fancy party wearing foam hands.,Season 4 has fewer scenes in actual classrooms, but the show’s philosophical underpinnings are still key. The focus has shifted to utilitarianism, with both Eleanor and Chidi sacrificing their personal happiness for the greater good. Agents of the Bad Place, led by Michael’s vengeful but acerbic former boss Shawn (Marc Evan Jackson), are trying to stymie the protagonists’ experiment at every turn, but the show hints at a possible compromise that would be in everyone’s best interests.,In season 1, the main characters become better people because they’re being tortured, and have to work together to help each other. When Chidi is stripped of responsibility and anxiety in the new version of the neighborhood, he rests on his laurels. He only starts to help others when he’s pushed into a situation that makes him deeply uncomfortable. In that way, , suggests that people behave better when they’re uncomfortable, and that the best outcome for humanity might involve at least a little pain. (Just not the Bad Place’s ideal of an eternity of repeated dick-flattening and reinflating.),In season 4, the dialogue feels a bit sharper than it did in season 3. And episode 4, “Tinker, Tailor, Demon, Spy,” comes the closest the show’s gotten to its highest point: season 2’s episode “The Trolley Problem.” The new episode has the usual splashes of absurdist humor, most notably a Pictionary drawing that comes to life as a nightmare creature. But it becomes a bottle episode that delves into the show’s fragile group dynamics, the nuances of its cosmology, and the strengths and weaknesses of individual characters, all by confronting the crew with the possibility that they have a Bad Place spy among them.,The writers clearly thought through all the easy ways out of the problem, building a conflict that explores the ethics of lying and the potential for redemption, while also leaving plenty of room for hilarious gags like Jason being way too eager to see Michael’s horrifying demonic form. It’s ,at its best, using a moral dilemma to force its dysfunctional cast of characters to work together, and cutting what could be a saccharine moral with barbed jokes and startling twists. If the rest of the season can deliver more episodes of that caliber, then the show will be able to save itself from its season 3 purgatory and return to the divine heights it’s capable of reaching."
Amazon will reportedly pay Fleabag creator tens of millions of dollars for three-year deal,"
          Sep 24, 2019,  1:23pm EDT
        ",Julia Alexander,"creator, writer, and star Phoebe Waller-Bridge has signed an exclusive overall deal with Amazon Prime Video, ,. The deal is reportedly for three years and valued in the “mid-eight-figure range,” ,is reporting,indicating tens of millions of dollars.,The announcement comes just after an incredibly ,. ,won three of the night’s most coveted awards in the comedy categories, including Best Comedy, Best Actress in a Comedy Series, and Best Writing for a Comedy Series. Waller-Bridge’s other series, ,, which airs on BBC America, also picked up a few awards. The overall deal between Amazon and Waller-Bridge was in “its final stages by this past weekend,” according to ,.,Waller-Bridge is one of the most sought-after creators right now, and Amazon’s exclusivity deal is just another example of the growing arms race for high-profile writers and creators as ,. Netflix reportedly paid ,, and ,showrunners David Benioff and D.B. Weiss ,. ,That race isn’t limited to Netflix and Amazon. WarnerMedia reportedly , and his company Bad Robot, ahead of its pending HBO Max launch. Abrams also reportedly walked away from a , for its new streaming service, Apple TV Plus, and signed with WarnerMedia because his contract gives him the ability to work with other networks and studios.,The next year will be dominated by companies trying to get people to sign up for their streaming services. WarnerMedia’s ,, NBCUniversal’s ,, Apple’s TV Plus, Disney’s ,, and even , are all launching services, and are eager to lock down exclusive content that can garner both attention and awards.,For Amazon, betting on , early — and giving Waller-Bridge the creative freedom to realize it — seems to have paid off. Reached for ,, the , creator said that working on the show,was a “creative partnership dreams are made of.”,“It really feels like home,” Waller-Bridge said. “I can’t wait to get going!”"
Ryan Murphy’s Netflix series The Politician is a perfect pairing with Election,"
          Sep 27, 2019, 10:40am EDT
        ",Noel Murray,"The Verge,, a 1999 political satire directed by Alexander Payne and co-written by Payne and Jim Taylor, adapting Tom Perrotta’s novel of the same name. Set in an Omaha, Nebraska high school, the film stars Reese Witherspoon as Tracy Flick, an energetic overachiever who irritates her smugly idealistic history teacher Jim McAllister (Matthew Broderick) with her aggressive self-promotion.,“Mr. M” sees Tracy as emblematic of a strain of prissy privilege, deleterious to the great American experiment. Chris Klein plays affable, dim jock Paul Metzler, whom McAllister encourages to enter the race for class president against Flick. Jessica Campbell plays Paul’s lesbian sister Tammy, who becomes the spoiler. , examines the simmering desperation of one middle-aged Middle American teacher, while also commenting on how even the least important political campaigns can devolve into shallow posturing and mudslinging.,Because the ,-esque series ,is now available on Netflix.,Co-created by , producers Ian Brennan, Brad Falchuk, and Ryan Murphy — a team that’s worked in various combinations on the TV series ,, ,, ,, ,, ,, and ,, among others — , stars Tony-winning Broadway actor Ben Blatt as Payton Hobart, an upper-class Santa Barbara teen hoping to use a high school election as a springboard toward his larger political goals. Gwyneth Paltrow plays Payton’s doting mother Georgina, while Zoey Deutch is Infinity Jackson, a sickly classmate Payton names as his running mate, to court a sympathy vote., is the first project Ryan Murphy has produced under a lucrative multiyear deal with Netflix. Before the first season even went into production, it had been greenlit for season 2. On the continuum of Murphy’s shows, ,has more in common with , and , than , or ,. The series comments on the superficiality of modern politics, but in a way that’s colorful and cartoonish, with a broadly comic take on privilege and popularity, not bogged down by wonky real-world details. , isn’t exactly a docudrama either, but while its characters are also comical (and rooted in stereotypes), the movie is predominantly about the daily grind of middle-class existence. Payne and Taylor let each of their main characters tell their part of the story via overlapping narration to illustrate the distance between their self-image and their actual behavior and also to mitigate the bitter undertones of McAllister and Flick’s voices with the relative sweetness of the Metzler siblings.,This story, though, is mainly about Mr. M, who teaches the same tedious facts every year, then goes home to his wife’s bland dinners and his secret stash of pornography. McAllister has a lot of options about morality and ethics, but his firmly held convictions don’t keep him from inviting his wife’s best friend to sleep with him — and at an American Family Inn, no less. Payne and Taylor are simultaneously empathetic toward and critical of a man who overestimates his own importance, interfering with a meaningless election in hopes of saving the world from Tracy Flick.,Broderick gives a wonderfully nebbishy performance, and the filmmakers do a fine job of using visual cues to define the smallness of his world — like the recurring image of his automatic seat belt, slowly wrapping tightly around his body every time he gets into his car.,Political junkies and Reese Witherspoon fans.,Witherspoon had a strong start to her career, giving a handful of well-received performances when she was still in her teens and early 20s. , showed off her knack for comedy and for playing larger-than-life, often unapologetically brash characters. Her ferocious Tracy (whose printed last name, “FLICK,” looks pointedly rude in certain typefaces) is a lonely soul with a megalomaniacal bent, for whom the American education system is less about accumulating knowledge and more about running up the score on her transcript.,Payne and Taylor, meanwhile, have fun mocking the drudgery of high school and the pointlessness of high school elections. Mr. M imagines the ritual as an exercise in democracy: it’s the freedom to choose between apples and oranges, he says, as he draws both fruits on a chalkboard as featureless circles. When Paul then astutely notes that his fondness for either apples or oranges varies depending on the day, that’s a funny, pointed metaphor for the fickleness of the American electorate.,Tubi and Vudu are both currently streaming , for free (with commercials). It’s also worth seeking out Payne and Taylor’s 1996 debut feature, ,, which satirizes the abortion debate via the story of a wastrel (hilariously played by Laura Dern) who becomes a national cause célèbre after she gets pregnant. It’s not available through any of the subscription or ad-supported streaming services, but most digital retailers offer it to rent or buy."
Netflix’s superhero drama Raising Dion struggles to find a Stranger Things balance,"
          Sep 30, 2019,  4:19pm EDT
        ",Samantha Nelson,"A young hero must learn to use his exceptional powers to stop a terrible threat and save his friends, family, and possibly the entire world. It’s a pretty typical setup for a superhero origin story, but Netflix’s new series ,, which launches its nine-episode first season on October 4th, changes things up by making its hero a seven-year-old. Splicing family drama with comic-book action produces some engaging story beats, but the friction between the two genres eventually makes the show fall apart., follows Nicole Warren (Alisha Wainwright), who’s left raising Dion (Ja’Siah Young) alone after his brilliant meteorologist father Mark (Michael B. Jordan of ,and ,) drowns saving a woman’s life. When Dion starts moving objects with his mind, Nicole realizes it’s really going to take a village to raise this kid, and she turns to friends, family, and more unlikely allies to help train and protect him.,While Jordan’s star power and boundless charisma is unfortunately limited to flashbacks and the occasional supernatural vision, creator / writer Carol Barbee has assembled a wonderful cast centered on the show’s charming, precocious title character. Young brings a powerful sense of joy and innocence to Dion as he discovers the extent of his powers and strives to use them to help others. He’s absolutely adorable as he sets about designing his own costume and Fortress of Solitude, which takes the form of a pillow fort in his room. The only sour note is the amount of product placement involved in his tendency to use his abilities to acquire his favorite name-brand snack foods.,Those powers add an extra layer to the traditional family-drama conflicts between Dion and Nicole who’s struggling to maintain a job and care for her son. Mark’s death has forced them to move out of a more affluent neighborhood and sent Dion to a new school where he struggles to fit in, both as a nerdy kid who loves science and comic books and as one of the few black students. ,One of the show’s most poignant episodes centers on an incident where Dion uses his telekinesis to stop skater bully Jonathan (Gavin Munn) from running off with his father’s watch. In a clear sign of racial bias, the principal blames Dion for the fight, forcing Nicole to talk with her son both about using his powers responsibly and about the hard life he’s likely to have ahead of him because of his skin color.,Barbee skillfully addresses the complicated social issues around racism and single parenthood, but she brings in plenty of humor to keep the story from getting too heavy. One of the main sources of comedy is Dion’s godfather Pat (Jason Ritter) who uses his knowledge of comic books to serve as a mentor while fighting with Nicole about his tendency to spoil the kid. Dion’s classmate Esperanza (Sammi Haney), who uses a wheelchair, fuses the show’s social consciousness and silliness. She wistfully talks about the pain of being invisible to the rest of the school, while forcefully pushing herself into the role of his new best friend. She also makes sure Dion’s fortress is up to Americans with Disabilities Act (ADA) standards.,These grounded, personal conflicts add depth to ,’s superhero fare, which is more boilerplate. Dion is pursued by a monster he dubs “the Crooked Man,” which is apparently killing other people with powers, in the style of ,’ Sylar or ,’s Whispers. The creature’s look appears to have been modeled after the Mind Flayer from , and ,also pays homage to Netflix’s smash hit about kids dealing with the supernatural by setting its theme as Pat’s ringtone. When Nicole and Pat want to understand the nature of both the threat and Dion’s abilities, they dig into Mark’s research for Biona, the science and technology company where he and Pat worked together. At times, that group seems just as shady as the various government operations running the show in ,.,In attempting to give equal time to family drama and science fiction, Barbee,doesn’t fully develop either. An episode meant to establish Nicole’s complicated relationship with her older, more successful sister Kat (Jazmyn Simon) feels flat because so much character development is forced into a single episode. When push comes to shove, Kat is willing to sacrifice her career and romantic relationship for Nicole and Dion, but that loss loses its sting since so little time is spent on showing what those things mean to her.,The issue is even worse when it comes to the complexities of the superhero plot. A major twist is telegraphed early enough that it’s not particularly surprising when it happens, but Barbee never devotes the time to explaining why or how it happens, making the shift feel jarringly abrupt. It’s particularly frustrating since the first season’s final episode includes a flashback to Nicole meeting Mark, which is sweet, but it easily could have come earlier in the show, leaving space for showing why events suddenly come to a head and how the story reached this point.,The climax is also watered down by the dual mandate to have Nicole’s personal plot reach its own conclusion. It’s discordant to watch her get so excited about finally earning health insurance and rekindling her passion for dancing right as her son is being threatened by a murderous monster. Late in the season, , brings up unusually powerful points about male entitlement and accepting boundaries. It directly confronts traditional TV plots, but, again, it’s brought up and resolved so quickly that it loses the intended impact.,Integrating personal dramas into comic-book stories is nothing new. That balance is at the heart of the CW’s slate of superhero soap operas, and it defines Peter Parker’s struggles to manage high school while he’s fighting supervillains. But the distance ,creates between the two elements by centering the story on the hero’s normal mother makes the show feel disjointed. Spider-Man’s plots can come to a head when he has to save a bus with his classmates on it, but there’s no reason for Nicole’s maybe-love-interest dance instructor to show up anywhere near the final showdown with the Crooked Man.,The mundane nature of the personal dramas in , creates further dissonances with the big stakes of its comic-book elements. The CW shows boost soap opera drama to superhero levels work by making the personal plotlines as outsized as the action, as characters learn that close relatives are secret supervillains or time-travelers. ,is clearly trying to mimic , with its intergenerational conflicts and focus on how relationships grow and change in the face of the unknown, but that show’s ensemble nature makes it easier to have a lot of smaller stories that only coalesce during the setpiece finish. After a decidedly underwhelming climax, ,teases its next season by setting up an even more trite cliffhanger. There’s certainly potential in the show’s premise and charming cast, and in its ambitious attempts to address issues that superhero stories normally avoid. But in order to succeed, the writers will need to find a better balance between the disparate parts."
