title,date,author,text
Mike Judge’s Silicon Valley take on power continues in Tales from the Tour Bus,"
          Oct 25, 2019,  2:48pm EDT
        ",Noel Murray,"The Verge,“Morris Day and The Time,” an episode of ,, an animated documentary series on Cinemax. For two seasons now, , has collected musicians’ wildest anecdotes about life on the road, playing alongside showbiz legends. Season 1 covered country music stars; season 2 focused on funk. The Morris Day episode is unusual, in that its true subject is really Day’s friend and rival, Prince. Each tale is introduced and narrated by ,/ , creator Mike Judge, who adds his own personal opinions and analysis, explaining who these performers are and what their music means.,Because Judge’s series , returns Sunday night on HBO.,This will be the sixth and final season for ,, which debuted in 2014 as the story of a socially awkward but innovative coder Richard Hendricks (Thomas Middleditch), who persistently struggles against the oppressive demands of tech giants and the personal weaknesses of his own friends. Over the course of the past five years, Judge and his creative team — aided by an all-star cast of comic actors, including Martin Starr, Kumail Nanjiani, and Zach Woods — have commented on the madness of modern business, where genuinely visionary ideas get choked to death by legal snafus and copycats. The show expresses a deep , of technology, but a skepticism about the people in charge.,That’s very much in keeping with the worldview expressed in other Judge projects, like the movies , and ,, and the TV shows , and ,. Judge tends to see anyone with power — however petty and inconsequential the power might be — as something of a buffoon, inclined to egomania, insensitivity, and a lazy incuriosity about the world outside their sphere of influence. Judge has more sympathy with ordinary schmoes who just want to do a job they believe in for eight to 10 hours a day, then go home and play video games. He doesn’t see these regular folks as heroic. In his films and television shows, the powerless make just as many mistakes as the powerful.,Judge explores an insider / outsider dynamic in a lot of the episodes of ,, which look at stars like Waylon Jennings and James Brown through the eyes of the men and women who spent months and even years playing shows with them around the world, and thus saw them at their weirdest. In the case of the “Morris Day and The Time” episode, Judge and his interview subjects tell the story of a colorful Minneapolis R&B act who became famous thanks to their old pal Prince, who played alongside Day, Jellybean Johnson, Jimmy Jam, and Terry Lewis when they were all starting out on the Twin Cities scene.,Prince produced the band, wrote most of their songs, and took them on the road as his opening act. In interviews with Johnson, Jam, Lewis, and Day, ,reveals that Prince also controlled The Time’s level of individual creativity, and even how popular the band could become. A big part of the story in this episode is about Day risking his career by rebelling against his mentor, and then reconciling with him shortly before Prince’s death.,Fans of , and backstage drama.,The animation is much stiffer in , than it is in ,, but the design is similarly flat and cartoony, like something out of an underground comic book. And it’s hard not to hear traces of Hank Hill when Judge narrates — he played Hill on primetime TV for more than a decade. Judge’s deliberate pace and clipped Texas twang lends a kind of folksy authority to his pronouncements about the heyday of funk in 1984, when the acts who debuted in the late 1970s were suddenly hobnobbing at the Grammys.,Judge also just knows a good story when he hears it. The “Morris Day and The Time” episode gets into the nutty origins of Day’s “mirror dance” routine (as seen in the movie ,) and his arm movements in the song “The Bird” (inspired by ,). The episode also features reminiscences about the days when The Time and Prince’s band The Revolution toured together, and tried to outplay each other every night. This particular tale is about the rich rock star with the state-of-the-art motor coach and the high-end after-show parties, vs. his buddies from the old neighborhood, who hosted debauched orgies after gigs, then piled onto a broken-down bus that always smelled like gasoline. That right there is a Mike Judge kind of contrast.,Cinemax’s Max Go service, or via the Cinemax subscription add-on to Hulu or Amazon Prime. For more Judge, , is on Hulu, and , is available via HBO."
The Mandalorian shows why Star Wars should be smaller ,"
          Dec 28, 2019, 10:30am EST
        ",Joshua Rivera,"Two months ago, just before , was about to premiere on Disney+, I made a joke to some friends: wouldn’t it be funny if this show was better than ,? I thought it was unlikely, but possible: ending a trilogy well is hard, and , didn’t have nearly as many expectations riding on it. Eight weeks later and , is out, a very profitable ,, and , concludes its first season with a finale that doesn’t try for much, but also rocks. It is, surprisingly, the better Star War.,(Very mild spoilers to follow.),Most of the reasons why I like , boil down to restraint: It’s full of things most Star Wars movies , do. It doesn’t have a Jedi, or anyone who’s even , of the Force. It’s not about a Chosen One. It’s not even particularly concerned with its place in any grand narrative — sure, the show makes it easy to figure out that it’s set after , and there are a number of familiar , accoutrements. But its overall story? Very much doing its own thing. ,Let’s recap: The eponymous Mandalorian is a bounty hunter who takes a high-paying job for a former Imperial officer. That job turns out to be a child with special powers. He decides not to hand the child over to the definitely evil Imperial holdouts, and goes on the run. The stoic Mandalorian and the adorable baby have adventures, most of them aiming for you to say, “Hey, that’s cool” about two or three times per episode. ,I love how inconsequential , feels, especially since the , films have been about people doing Big Important Things involving the fate of the galaxy or whatever. It even ends with a reassertion of the status quo: Mando and The Child, out and about. What will they find next?,A big part of the , charm is the way that it feels like a world you can live in. And ,? It shows people just trying to get by, out in the galactic equivalent of a small midwestern farm town. Sure, the Empire has fallen and the New Republic is starting to get its feet (only to fall again by the time , rolls around) but none of that matters. Out here, they’re just trying to raise ugly lizards and gas up their spaceships so they can make it to the next job. ,Now that I’ve seen it, this is the , I want more of. Smaller stories, about smaller people, being noble or selfish in ways that ripple through their own communities, not the whole damn galaxy. It’s this implication at the heart of , that made that movie so compelling, and the diversions , made into the lives of Clone Troopers fascinating to watch. We come to ,for the big and spectacular, but we stay because it always left room for the small and intimate."
"New Mandalorian trailer promises Star Wars beasts, fighting spaceships, and bounty hunters","
          Oct 28, 2019,  9:17pm EDT
        ",Julia Alexander,"A new trailer for Disney’s first ever live-action , show, ,, has arrived, just a couple of weeks ahead of , highly anticipated launch. ,The new trailer includes a few interesting shots, including putting a spotlight on some of the space beasts that will come across the Mandalorian’s path. There are also new spaceship fights, and a promise that fans will get a deeper look at bounty hunting — a “difficult profession.” The time for peace has come to an end. ,Set in between ,and the rise of the First Order in ,, the show follows a new character played by Pedro Pascal (,). Pascal described him as “a mysterious lone gunfighter in the outer reaches of the galaxy,” during a panel for ,at this year’s Star Wars Celebration in April. The series is heavily inspired by fan-favorite character Boba Fett and his father, Jango. ,Executive producer Jon Favreau ,that the goal is to showcase a “darker, freakier side of ,The , took on a ,tone, with helmets on stakes, and ominous shots of people in the desert. Still, the trailer certainly leaned into more traditional , action, including scenes featuring fighting spaceships, battling droids, and face-to-face confrontations.,is one of Disney+’s most ambitious projects, with the series costing “around $100 million” to make, ,. That puts each episode at approximately $12.5 million, on par with some of ,’,final episodes. It will be released weekly, with the final episodes being released in conjunction with ,in December. ,will premiere on November 12th, when Disney+ launches. Disney+ costs $6.99 a month. A bundle with sports streaming service ESPN+ and ad-supported Hulu is also available."
"New trailers: Silicon Valley, Star Wars: The Rise of Skywalker, and more","
          Oct 26, 2019, 10:00am EDT
        ",Jacob Kastrenakes,"I’m writing this entire column having just gotten back from seeing ,, so you’ll have to excuse me if my thoughts are a little scattered because , is, to put it mildly, completely bonkers. There are no words to properly describe my feelings toward that film.,To be clear, you should ,, the new movie from , director Bong Joon-ho, assuming any of this sounds appealing to you. The film somehow manages to strike a balance between being very fun and funny, and being extremely tense and serious, packed inside what could maybe be very vaguely described as a heist movie about class, earning every moment of it along the way.,It’s not often that you get to see a movie where you truly have no concept of where it’s headed, and , delivers on that in a deeply fulfilling way.,Check out seven trailers from this week below.,Here it is, the one and only trailer that matters this week. This month. This year? I’m excited, and I’ve already bought my tickets (for night two, so everyone be cool). I’ll admit: I kind of imagined Kylo being the main villain in this one, and I’m not sure how the return of an antagonist who’s been entirely absent for two films is going to pan out. But we’ll see soon enough — the film comes out December 20th., is wrapping up after a six-year run, and it arrives at a time when big tech might need more skewering than ever. The season starts October 27th.,You know, for a movie with a name as truly dumb as ,, , has a much more interesting sci-fi conceit than you’d expect. It’s sort of like , but with a darker element of manipulation and more rippling muscles. (I haven’t seen , so... apologies if those are , in that movie.) It comes out February 21st.,Amazon is bringing France’s 2020 Oscar submission to the US. The film, from director Ladj Ly and winner of Cannes’ Jury Prize (essentially 3rd place, though worth noting that it lost to ,, which, having just seen ,, ...,), is inspired by the 2005 riots in Paris, focusing on a group of men tasked with keeping the peace. It comes to theaters January 10th.,Everything I see from Charli XCX makes it clear ,, and this just seems to be the latest example. She’s crafting a new band and using a Netflix show to help build their star power along the way. I have no doubt she’ll write them some seriously catchy songs, too. The show comes out November 15th.,While I think the combination of Eddie Redmayne, Felicity Jones, and hot air balloons is generally a little cheesy, I’ve heard good things about , so far. Amazon recently abbreviated the film’s theatrical run, so it starts streaming on December 20th, after premiering in theaters just two weeks earlier, on December 6th.,has actually been in a very small number of theaters for the past two weeks, but now it’s a week away from heading to Netflix. It’s a surprisingly cool-looking adaptation of Shakespeare’s plays, and it might just hold us over until the 2019 Timothée Chalamet performance we’re really waiting for comes along — his role as Laurie in ,. , starts streaming November 1st."
Game of Thrones showrunners quit Star Wars trilogy to work on Netflix projects,"
          Oct 29, 2019, 12:00am EDT
        ",Sam Byford," showrunners David Benioff and DB Weiss have abandoned plans to work on a trilogy of , movies. “There are only so many hours in the day, and we felt we could not do justice to both , and our Netflix projects,” the pair ,. “So we are regretfully stepping away.” ,Benioff and Weiss recently signed a $200 million multi-year , to produce exclusive content. The decision to walk away from the , universe means that the pair’s output will be solely under Netflix’s umbrella for the foreseeable future. The first of their , movies was due to hit theaters ,.,“David Benioff and Dan Weiss are incredible storytellers,” Lucasfilm president Kathleen Kennedy said. “We hope to include them in the journey forward when they are able to step away from their busy schedule to focus on ,.”,“We love ,,” Benioff and Weiss’ statement continues. “When George Lucas built it, he built us too. Getting to talk about , with him and the current , team was the thrill of a lifetime, and we will always be indebted to the saga that changed everything.”,It’s unclear whether Disney plans to continue with the trilogy that Benioff and Weiss were planning, but the company has a ton of , projects on its slate. Another , trilogy from , director Rian Johnson is still in the works, while Marvel Cinematic Universe producer ,, and Disney+ is launching next month with ,. , also sees release in December, of course, and Ewan McGregor will reprise his role as Obi-Wan Kenobi for a forthcoming Disney+ series.,Disney declined further comment to ,on its future , plans."
Sony is shutting down its live TV service PlayStation Vue in January 2020,"
          Oct 29, 2019,  2:02pm EDT
        ",Nick Statt,"Sony is shutting down its live TV streaming service PlayStation Vue on January 30th, 2020, the ,. The sudden announcement of the shutdown comes just a week after a ,saying Sony was looking for a buyer for the service, which has continually lost money for the company since its launch in March of 2015. Sony has repeatedly raised the price of Vue to try to offset its rising costs, most recently ,. ,“Unfortunately, the highly competitive Pay TV industry, with expensive content and network deals, has been slower to change than we expected. Because of this, we have decided to remain focused on our core gaming business,” Sony said in a blog post announcing the shutdown. “PlayStation fans can continue to access movie and TV content through the PlayStation Store on PS4 and via our partnerships with top entertainment apps.”,PlayStation Vue launched four years ago as an early competitor in the so-called pay-TV market, which is a restructured form of cable made popular by companies like Sling. Like most other vendors, Sony offered a skinny bundle of channels with the option to add more premium ones, like sports and entertainment channels, by paying a higher monthly subscription fee. After the price hike, the entry-level Vue plan cost about $50 a month. At its height, Vue amassed about 500,000 subscribers, which is far less than competitors like Sling and YouTube TV, , reported last week. ,Ultimately, it looks like Sony couldn’t make the economics work, as the cost of licensing cable channels far outweighed the money Sony could recoup on subscriptions. Vue’s demise is also a signal that customer interest in traditional cable bundles, skinny or otherwise, continues to shrink. As a result, major players in the entertainment industry are , to compete with Amazon and Netflix. That includes Disney with Disney+, Apple with Apple TV Plus, AT&T with HBO Max, and NBCUniversal with Peacock, among others. "
