title,date,author,text
"Hunters review: good at killing Nazis, and very bad at most other things","
          Feb 19, 2020,  8:43am EST
        ",Joshua Rivera," has a premise that feels like a double entendre. Amazon’s Jordan Peele-produced drama about Nazi hunters in the 1970s feels made with this specific moment when white nationalist sentiment gets parroted by government officials and in the national news. Characters are constantly saying things in a way that winkingly acknowledges the camera: ,The delivery always sounds like a dick joke, but the dick is Nazis. ,The slow-burn premiere introduces Jonah Heidelbaum (Logan Lerman), a Jewish teenager who lives in Brooklyn with his grandmother. When said grandmother is murdered in their home, Jonah discovers something she hid from the world: she was a member of a secret fraternity of Nazi-hunting vigilantes, exacting revenge on those conspiring to bring about a Fourth Reich. ,Headed by the wealthy Meyer Offerman (Al Pacino), the Hunters (if they sound like a superhero team, that’s intentional) methodically vet and seek out their victims and dole out painful justice on them, making sure they know exactly what crimes they are asking for. Interspersed throughout are interludes and flashbacks to concentration camps and the atrocities committed therein, lest the viewer start to feel that the Hunters are being a little , cruel. ,There are also strange diversions into dance, Guy Ritchie-style title cards but with a Yiddish exploitation twist, and fourth wall-breaking sketches. The villains monologue and salute a long-deceased Hitler with tears in their eyes. , is in the business of hurricane-force whiplash.,The only real anchors in all of this are the show’s two leads, Jonah and Offerman, and unfortunately, only one of them works. Despite being the de facto protagonist, Jonah doesn’t offer much to latch on to as a character. We get brief glimpses of his personal life — his friends, his crush, the anti-Semitic bully who tries to cheat Jonah out of the drugs he has to sell in order to help his grandmother pay the rent — but it’s all in the service of the plot. If we meet a person in his life, it’s because they’re going to ferry him to wherever he needs to be for the next scene to happen. ,This makes all of his big moments feel like they occur in a vacuum — especially when he’s paired up with the other Hunters, all of whom have a disappointingly small amount of screentime. Pacino is great. Everyone else makes you wonder what their deal is. (Also, Josh Radnor is on this show... why?),The five episodes that were made available in advance to critics leave things at a critical juncture halfway through the 10-episode season. Some of ,’ biggest thematic questions revolve around whether ends justify means or if the pursuit of vengeance risks corrupting those who seek it. These are familiar questions, perhaps even tired ones, but it’s possible that , comes up with an interesting answer. ,This is the upshot of a show as tonally uneven as ,: there’s no telling how it’s going to end. It’s hard to be optimistic. While the show does a lot of different things, one thing it doesn’t do is spend its time well. The first episode is nearly an hour and a half long; each of the four that follow clock in at about an hour. An inordinate amount of that time is spent mulling over a missed opportunity, longing for moments with the barely expressed rage of Pacino’s Offerman, or following any of the other Hunters instead of Jonah. It’s telling that, for all its stylistic quirks, the show is at its best when it’s playing it straight: the fourth episode, which tells twin stories of a bank heist and a couple’s desperate escape from a concentration camp, is among the best of the bunch and is delivered in a simple fashion. ,Like the eponymous team it follows, ,has a list of goals, and some of those goals are in conflict with one another. It wants to be a harrowing remembrance of the suffering of the Holocaust, a satisfying revenge fantasy, a sensational period piece, and a dark comedy. These can all be achieved together with skill, but only if the tension between them is acknowledged and addressed. Instead, the show shifts from tone to tone, more temperamental than genre-bending thrill ride.,It’s frustrating because even the ridiculous, preening Nazis of , share a trait that real-life fascists have: they know what they want. A show about the people who fight them should, too."
This disturbingly realistic deepfake puts Jeff Bezos and Elon Musk in a Star Trek episode,"
          Feb 20, 2020,  3:35pm EST
        ",Jay Peters,"A new deepfake puts Amazon CEO Jeff Bezos and Tesla CEO Elon Musk in the pilot episode of the original ,, “The Cage” — and I kind of love it. In this particular AI-powered face swap, Bezos plays a Talosian alien with a huge bald head, while Musk plays Captain Christopher Pike (who is the captain of the USS Enterprise before James T. Kirk). 	,Here’s a very short version of what’s going on in this scene, if you’re wondering: in this episode, the Talosian aliens capture Pike to enslave him and use him to breed humans that will be used to rebuild a destroyed society. Pike tries to escape throughout the episode, and eventually, the Talosians decide that humans’ resistance to captivity won’t make them a good fit for that plan.,The conversation is kind of hard to follow, and that’s probably because the clips from the episode are stitched together to make it seem like it’s only the Talosian alien and Captain Pike having a conversation. In the actual episode, there are a number of other characters who are critical to the conversation that this deepfake doesn’t show. ,But even though the scene is confusing, I think the deepfake is scarily impressive, particularly the unsettling-looking Bezos as a Talosian alien. It “marks” the second , cameo for the Amazon CEO: he appeared in 2016’s ,, also as a ,."
Netflix’s first Stranger Things 4 trailer teases the return of a missing friend,"
          Feb 14, 2020,  9:28am EST
        ",Chaim Gartenberg,"Netflix has released the first teaser for ,, the upcoming fourth season of its breakout series, and it features a surprise reappearance of a fan-favorite character. ,The teaser doesn’t reveal too many details about the upcoming season, but it seems like the promise that the series would be expanding its world beyond the town of Hawkins, Indiana, is correct: the trailer shows a group of workers building a railroad somewhere in Russia. ,But the big surprise comes at the end of the clip. As many fans have already guessed based on the post-credit sequence in the final episode of the third season, Chief Jim Hopper (David Harbour) is back, despite appearing to have perished in an extradimensional portal. ,Presumably, Hopper’s survival has to do with the latest supernatural meddling in the Upside Down, given that the Russians were previously shown to have a captive Demogorgon monster. ,There’s no release date yet for the fourth season of ,, but with Netflix starting up the marketing campaign already, it likely won’t be long before the show hits the streaming service. "
Netflix’s Gentefied follows a Mexican American family in the heart of a gentrifying LA neighborhood,"
          Feb 21, 2020,  2:07pm EST
        ",Joshua Rivera,"In ,, everyone knows the score. That’s the dark joke about being a young person of color in the US, where access to information is more equitable than the power to use that information. It’s easy to know exactly how you’re being shut out of opportunity and hard to do anything about it. For the Mexican family at the heart of ,, the game is clearly rigged, and winning it might cost more than it’s worth.,Netflix’s new half-hour dramedy from producer America Ferrera and writer / creator duo Linda Yvette Chavez and Marvin Lemus follows a trio of cousins who struggle to keep their grandpa’s taco shop afloat in Los Angeles’ Boyle Heights neighborhood. This is harder than it’s ever been: gentrification is sweeping through the neighborhood, slowly forcing the Chicano population out of town at a time when money isn’t easy to come by. ,Each cousin has their own dream in addition to the family one: Ana wants to be an artist and struggles to scrounge together expensive supplies and find a showcase for her work. Erik is torn between being responsible for running the shop and his desire to have a family of his own. Chris, just back from college, wants to be a chef in Paris, though it means stifling his Mexican heritage. ,In following the three of them and those in their orbit, , is both a celebration of a modern Mexican American family and also the story about their struggle against the ever-present threat of erasure. At every juncture, there’s something that wants them to forget who they are. In his studies to be a chef, Chris has developed an affinity for the upper-class, culturally sterile world of fine dining. Ana’s desire to find a platform for her art puts her at odds with her activist friends. Erik’s pride and machismo jeopardize the profitability of the shop and his relationship with Lydia, his estranged, pregnant ex who he wants to prove he’s good enough for. ,Lined up above them all are the invisible guillotines that dangle over many people of color in America. The ever-present call of the landlord; the racism of employers that must go unanswered, lest you lose your job; and the ambient threat of ICE officers who do not particularly care if you are a citizen. ,The show does seem to sometimes rely on a checklist, the kind that comes into play whenever there is a story about the slow infringement of wealthy white people on communities of color. A lot of the same tropes are present, whether it’s a show like , or ,or , before it. There are millennials who want all the same Instagram-friendly food and decor for taco Tuesday, landlords who would rather rent to said millennials at top dollar than the already-high rates they charge their current tenants of color, and the upper-middle-class institutions that only really want people of color if they clean up their act. (Read: be more white.),Because of this, ,is at its best when it gets specific: a midseason episode that follows a mariachi singer who frequents the taco shop, another that chronicles the lifelong friendship and romance between Ana and her girlfriend Yessika, or Chris’ ongoing struggles to prove to his fellow line cooks that he is “Mexican enough” and not a “coconut” (a term implying that he’s brown on the outside, white on the inside). ,Stories about the children of immigrants often revolve around the fundamental tension of being caught between the culture of their parents’ homeland and that of the home where they were raised. These kinds of stories are as old as immigration itself. In ,, there’s the modern wrinkle of “authenticity,” the monied interest in a culture sanitized for white consumption and social media clout without any concern for place, for people, for history. It is a constant pressure, easy to give in to and fun to participate in. ,It’s also impermanent. Soon, there will be something else. The tastemakers will move to another neighborhood, and no one will care for the accommodations once made for them. This is the existential threat facing the children of immigrants now. Fighting it seems impossible, an extra set of obstacles in addition to the regular set of hurdles you have to clear in order to achieve the better life your parents want for you. Give in, and all that will be left is the exorbitant rent in a gutted neighborhood your family left long ago, leaving fragments of a culture you are already starting to forget. "
"New trailers: Westworld, Amazing Stories, and more","
          Feb 22, 2020, 10:00am EST
        ",Jacob Kastrenakes,"I recently watched ,, Joanna Hogg’s partly autobiographical film about a young filmmaker who gets wrapped up in a toxic and emotionally abusive relationship with an older man. While looking up where to stream it, Google presented me with its “top voted tags” for the movie (I have no idea how these are generated), which were: slow, boring, pretentious, overrated, confusing, strong acting, and “+3 more.” ,, I thought.,One fascinating technique the film repeatedly uses is to obfuscate the beginnings of things and drop us into events well past when they’ve begun. The entire beginning of the central romantic relationship is left offscreen, as is all but the ending of a very significant argument between the couple. It’s disorienting and strange, but it helps to convey the feelings of the protagonist — suddenly in over her head, not entirely sure of how things got this way.,There’s apparently a sequel in the works. The film by no means calls for one, but I think there’s something very cool about making a sequel to a film that traditionally wouldn’t get one.,Check out nine trailers from this week below.,After almost two years off the air, ,’s season 3 premiere is almost here. This season takes the hosts out of the park and into the real world where it seems like they teach Aaron Paul that capitalism is evil. Everything about this show has been ludicrous from the start, and it looks like none of that is changing. The series will return on March 15th.,Apple is rebooting the classic anthology series ,. The original show came from Steven Spielberg, and his production company is behind the reboot, so it makes sense just how warm, awe-filled, and Spielbergy all of these stories look. The show will debut on March 6th.,Here’s the latest trailer for ,, HBO’s adaptation of a Philip Roth novel about a racist demagogue who shocks America by winning the presidency and stoking violence across the country. It will premiere on March 16th.,PBS has a new documentary coming up about the life, music, and influence of Miles Davis. The film premiered at Sundance last year to positive reviews, with , it “contains more rare footage and photos than can really be digested in two hours,” which I think is a compliment. The documentary will come to PBS on February 25th.,Reese Witherspoon and Kerry Washington star in Hulu’s adaptation of , based on Celeste Ng’s hit 2017 novel. It feels like Hulu is trying to find the next thing to watch for fans of ,and ,, with big stars and plenty of drama and mystery. It will premiere on March 18th.,Ellen Page narrates and co-directs this documentary about how black and indigenous communities in Canada have often borne the awful effects of companies polluting the environment. It comes to Netflix on March 27th.,Netflix has a new YA series coming up about a teenage girl who starts to develop some sort of bizarro, Eleven-like powers that she’s unable to control. Except instead of there being some weird nightmarish monster conspiracy she’s running away from, she’s mostly just surrounded a colorful and twee coming of age story. It’ll come out on February 26th.,Pete Davidson plays a college dropout who basically just acts like you’d expect Pete Davidson or a Pete Davidson character to act in ,, a coming-of-age film that has him serving as a very poor role model for a high school student. Hulu acquired the film, so it’ll be streaming on the service on March 20th, a week after it hits some theaters.,HBO is bringing one of its European shows to the US, and it looks wonderfully ridiculous. It’s about time-traveling Vikings and cave people, and I just really don’t understand any of what’s happening. The series debuted this week."
Activision Blizzard exec leaks that Overwatch might become a TV series,"
          Feb 18, 2020,  7:08pm EST
        ",Taylor Lyles,"Since 2014, Blizzard has released so many , cinematic videos for ,that most of us have wondered when Blizzard would finally , to the big screen or as a TV show. (The comparisons to Pixar have been around ,.) Well, an Activision Blizzard executive’s resume now hints that Blizzard did explore the possibility of an actual , TV show, one that might even still be on the way — and there may be a , one, too. ,According to the , of Nick van Dyk, who just so happens to be in charge of the part of Activision Blizzard responsible for building TV shows and movies, he was personally involved in developing and selling an animated , TV show. The rest of his resume suggests he might have been just the man for the job: he previously worked at Disney, where he played , in helping the company acquire Pixar, and he apparently sold an anime-style , show to Netflix as well. ,If that’s true, it confirms , that Netflix had one in the works — though it’s not clear if the show is still in production. van Dyk’s profile notes that the , TV series was only “sold,” not greenlit, and that the , show was in “pre-production” at some point. Blizzard has not made any official announcement surrounding either project, so it’s possible neither one will get off the ground. "
Save on Blu-ray versions of the Twin Peaks show and Fire Walk with Me prequel film,"
          Feb 24, 2020, 10:00am EST
        ",Cameron Faulkner,"February 24th is a special day for , fans. It’s the day when protagonist Dale Cooper first entered the town of ,, kicking off the cult classic TV series that saw a ,. If you haven’t seen the show or the prequel film, or you are obsessed with the idea of owning physical copies of them, you can save a lot today.,For , fans who can’t get enough, the ,: From Z to A collection is down to its lowest price yet today. Normally $156, it’s $90. This box set contains Blu-ray editions of all three seasons of the show, including the , film and , deleted scenes. Additionally, it comes with a disc full of special features and some physical goodies in the box.,If you just want all of the TV episodes, including the ones from the season 3 revival, you’ll find that in the ,: The Television Collection. Normally $77, it’s $40 right now for the Blu-ray version. It’s far cheaper to get this bundle than it is to get the third season on Blu-ray by itself.,You might be someone who has seen the original episodes from the early ‘90s (they’ve been streaming on Netflix for the past few years) but haven’t seen anything else. Before you watch the third season, I recommend watching ,. It’s a prequel to the original show, and it will answer a lot of questions you might run up against in the newer , episodes. The Blu-ray copy is $20 instead of $25.36."
Better Call Saul knows how much we love a good scam,"
          Feb 25, 2020,  3:09pm EST
        ",Joshua Rivera," was always going to be a show about a man dying in slow motion. At the start of the series, Saul Goodman — best known as Walter White’s huckster lawyer in , — goes by another name, the one given to him at birth. Jimmy McGill is a different, more earnest person than Saul Goodman, someone who does not exist in ,. Unlike Walter White, we know exactly what’s going to happen to Jimmy, and ,is a better show for it. ,In the show’s fifth season, Jimmy’s transformation into Saul is nearly complete. McGill is getting his feet under him after the death of his brother and the end of a yearlong suspension from practicing law. Now, he’s back in the saddle and trying to build his practice as fast as possible under his Saul Goodman alias, which he used for much of the last season to build connections with petty criminals he sold burner phones to for fast cash. ,It’s all so very sad, even if Bob Odenkirk’s carnival barker performance as Jimmy / Saul is as entertaining and funny as it’s always been. As a man who lost his brother, Jimmy never gives himself the opportunity to mourn, instead throwing himself back into the world of two-bit hustles that he knows best, working over suckers and building his reputation in the untapped market of low-level criminals in the habit of committing misdemeanors. Bit by bit, Jimmy McGill is being buried alive, and Saul Goodman is holding the shovel. ,Like the show from which it spun off, ,’s dramatic arc is an inevitable one. We know that things aren’t going to end well from the start — to a degree that , might sound repetitive to people who have seen ,. On a superficial level, this is true: both are shows about a man going sour. But the hows and whys of ,’s downward slide feel more vital and relevant, perhaps because they are more tragic. ,If ,showed us what entitled toxic masculinity looked like when it ran rampant in the life of the most milquetoast protagonist imaginable, , is about a slower, sadder thing: a man who learns that having feelings is for suckers. It’s a show for the irony-poisoned and extremely online where nothing is assumed to be genuine, and everything is probably a scam. , is concerned with what happens when people decide that scamming is the only way to win, and the immense harm inflicted by people who have convinced themselves that anyone behaving earnestly is just playing the game wrong. In ,, this is illustrated by Kim Wexler, Jimmy’s longtime friend and girlfriend / partner, a damn good lawyer in her own right with a bit of a grifter’s streak in her. ,Kim, however, is a character of integrity with a sense of justice and lines that she only crosses when that notion of justice is violated. She’s a vigilante scammer where McGill is an equal-opportunity swindler. At the end of the day, she believes in the system and in Jimmy’s capacity to be an honest man. This means, in ,’s universe, she’s doomed. ,In this penultimate season — the show will only return for one more — Kim is learning a truth that Jimmy’s in denial of: no matter how much you tell someone that they are capable of being honest or good, once they have decided that truth does not pay, it’s only a matter of time before they stop maintaining the charade altogether. And once someone has lost every reason to believe in earnest feeling or honesty or justice, they slowly start believing everyone else has, too. ,This is what , has been building toward: a fifth season premiere where Jimmy, as Saul Goodman, erects a carnival tent in an empty lot, surrounded by people who he believes are lost causes who will eventually need a lost cause like himself. The descent is more or less complete. As Jimmy builds the Goodman name, the cartel power players from , begin asserting themselves, and the gilded cage Saul Goodman will ultimately try to flee at the end of that series is nearing completion. He’s going to have it good for a while, though. Grifters always do. That’s part of the problem: we love a good scam. Feelings are for suckers. "
Netflix rolls out Top 10 feature to help show what people are actually watching,"
          Feb 24, 2020,  2:56pm EST
        ",Julia Alexander,"Netflix is trying to make it easier for subscribers to keep up with what people around the country are watching by introducing a Top 10 row to its homepage. ,A , notes that the Top 10 row will be updated every day with the most popular titles within a subscriber’s country, and the position of the row will also change depending on how relevant the shows and movies in the list are to their interests. Netflix also notes that subscribers can get an even better sense of what’s trending by clicking on the individual movies and TV show tabs to get top 10 lists for each respective category.  ,Netflix first started experimenting with a top 10 list in the ,. “For those who want to watch what others are watching, this may make choosing titles even easier,” CEO Reed Hastings wrote in a , back in April 2019. It’s unclear just how many of the movies and TV shows that make it into the Top 10 are licensed and how many are Netflix original series, but both are eligible, the company confirmed to ,. ,At the end of last year, Netflix released a list of its most popular movies and TV shows and, with the exception of ,, every title on the list was a Netflix original. The company has lost many of its top titles that it licensed from studios and networks like Disney, FX, NBCUniversal, and Warner Bros. as the companies release and gear up to launch their own streaming services. That, in turn, makes the shows and films Netflix produces more popular on the platform and more vital to the company’s business. ,The Top 10 row is available to Netflix subscribers starting today, and it will appear with a different design than other traditional rows of content on the streaming service to make it easier to distinguish. "
